id	score	sentence1	sentence2
1	4.172111	the man is planning to shoot a wedding	the woman is going to a wedding.
2	2.1036298	A man is bowling.	A kitten is walking.
3	4.564957	The A920 comes with a printer, scanner, and copier for $89.	Dell's Personal All-in-One A920 is an entry-level device that combines printer, scanner and copier functions for $89.
4	4.4329615	Further testing is still under way, but at this stage, given the early detection, the outlook in such instances would be positive, the specialist said yesterday.	But at this stage, given the early detection, the outlook in such instances would be positive, he said.
5	3.1465719	A man holding a cat.	A man holding a dog.
6	4.2992973	Kyi, a U.N. envoy says, as Japan adds to growing international pressure by saying it will halt its hefty economic aid unless Suu Kyi is freed.	JAPAN added to growing international pressure on Burma yesterday, threatening to halt its hefty economic aid unless the military government released pro-democracy leader Aung San Suu Kyi.
7	4.0471373	I'm afraid we are out of luck in this one.	I think this is one of those things where you are just out of luck.
8	4.294791	"They said they had concluded that the film failed ""to present a balanced portrayal"" of the Reagans."	"CBS said the show ""does not present a balanced portrayal of the Reagans for CBS and its audience."
9	2.9553418	A brown and white cow in a field looking into the camera.	The black and white cat is looking up at the camera.
10	4.787535	One boy is pushing another boy on a swing.	A boy is pushing another boy on the swings.
11	4.522005	A woman riding a brown horse.	A girl riding a brown horse.
12	4.0547934	There are a few things you can do: 	There are a couple things you can try.
13	4.3791847	I think it is depends on the program.	It depends on how the term is used I think.
14	4.6630673	Can you do this?	So, CAN you do this?
15	4.021104	A group of people are nervous about crossing the water.	A group of people are on the water.
16	4.4660316	Authorities said the scientist properly quarantined himself at home after he developed SARS symptoms Dec. 10.	The scientist also quarantined himself at home as soon as he developed SARS symptoms, officials said.
17	4.167809	Three young men run, jump, and kick off of a Coke machine.	Three men are jumping off a wall.
18	4.3041315	A person is playing an electronic keyboard.	A kid is playing keyboard.
19	3.8063946	There are four people outside.	Five people are outside.
20	4.6572514	A train is at a train station.	The train sits at the train station.
21	3.2101586	There are a few things I think you should do.	There are a few things I don't understand:
22	4.604817	I was in a similar situation.	I am in a similar situation.
23	4.901678	Wal-Mart, Kohl's Corp., Family Dollar Stores Inc., and Big Lots Inc. were among the merchants posting May sales that fell below Wall Street's modest expectations.	Wal- Mart, Kohl's Corp., Family Dollar Stores Inc., and Big Lots Inc. posted May sales that fell below Wall Street's modest expectations.
24	3.9786851	A 25 percent increase would raise undergraduate tuition to about $5,247 annually, including miscellaneous, campus-based fees.	The 25 percent hike takes annual UC undergraduate tuition to $4,794 and graduate fees to $5,019.
25	4.20639	"The best the investigators can do is nitpick about the process and substance of isolated business decisions ... and question his competence as a manager."""	"Ebbers' lawyer, Reid Weingarten, said despite the thorough investigation, ""the best the investigators can do is nitpick about the process and substance of isolated business decisions."""
26	4.4640946	Two black and white dogs at the bottom of stairs.	A dog is lying at the bottom of a staircase next to another standing dog.
27	2.1980488	Two men are dancing together.	A woman opens a closet.
28	4.277103	Three men posing in a tent.	Three men eating in a kitchen.
29	4.3735332	The cat is licking a bottle.	A cat plays with a small bottle.
30	4.402423	Site Finder has been visited 65 million times since its introduction, Galvin said.	Through Sunday, Sept. 21, Site Finder has been visited over 65 million times by Internet users.
31	2.1419573	A group of dark-skinned people are walking past barbed wire.	Two women are gossiping by a fence.
32	4.541501	A person wipes butter on a tray.	A person is buttering a tray.
33	4.900523	Maybe this could work for you.	Maybe this can work for you.
34	4.2087655	A white bird with long orange legs standing by a lake.	Large white bird with long orange beak standing on the shoreline.
35	4.382313	Its keywords are supported by Chinese language Web portals.	Chinese language Web portals also support 3721 keywords, the Web site said.
36	4.915942	Deirdre Hisler, Government Canyon's manager, said the state has long had its eye on this piece of property and is eager to complete the deal to obtain it.	Deirdre Hisler, Government Canyon's manager, said the state long has coveted this piece of property, and is eager to complete the deal.
37	3.4470615	You might have to try a variety before you find one that clicks with him.	My advice would be to try a variety of coffees that you can afford and find one you like.
38	2.8498247	A man reels in a fish.	A woman is pouring oil in a bowl.
39	3.5796795	A man is playing a flute.	A man is riding a scooter.
40	3.92369	The life expectancy for boys born in 2001 was 74.4 years, up two years since 1990.	According to the report, average life expectancy has increased by nearly two years since 1990.
41	4.189182	A black and white dog is jumping into the water.	a white dog runs across the water.
42	2.67984	There are two ways to start with: plunging and dripping.	There are two traditional ways to bend wood:
43	4.7353463	One person wields an umbrella.	One person is holding an umbrella.
44	1.841948	I've located an article that might be of some help: http://www.dsattorney.com/qa-pseudonyms-in-contracts/	I found some link that might be of help to you:
45	4.502445	A black dog standing in a grassy area.	A long-haired dog stands in a grassy wooded area.
46	4.9650564	Two men talking in front of a plane.	Two men talking in front of a small plane.
47	4.243457	One, Fort Carson-based Sgt. Ernest Bucklew, 33, had been on his way home to attend his mother's funeral in Pennsylvania.	Sgt. Ernest Bucklew, 33, was coming home from Iraq to bury his mother in Pennsylvania.
48	3.3282375	The best thing you can do is to know your stuff.	My recommendation is not to say anything, and do the best you can.
49	3.3744195	A boy is crawling into a dog house.	A boy is playing a wooden flute.
50	4.932794	A light-colored dog runs through the grass.	A dog runs through the grass.
51	4.793784	A bird flies across the water.	A bird flies above the water.
52	4.438986	The train sits at the train station.	A train parked at a train station.
53	3.1111116	A man is slicing a tomato.	A man is riding a horse.
54	3.4585	the men are about to score in a water polo tournament	The two men are about to compete in a match.
55	3.7502904	It's pretty much up to you.	It's much better to ask.
56	4.3186502	The industry's largest association is urging its members not call the more than 50 million home and cellular numbers on the list.	Meantime, the Direct Marketing Association said its members should not call the nearly 51 million numbers on the list.
57	3.2526832	Yes, it is possible to publish a paper on model analysis.	Yes, it is hard to publish in a peer reviewed journal.
58	3.912288	A group of black people in front of a building with a moped.	A group of people are outside a decrepit building.
59	3.0278063	a little girl is laughing at the camera.	A white cow with big ears looking into the camera.
60	4.235775	A boy skateboards down the railing of some graffiti stairs	A skateboarder slides down a handrail on his feet.
61	4.4072375	It's also a matter of taste.	It's definitely just a matter of preference.
62	4.705548	How do you do that?	How to do that?
63	4.5056515	A yellow bird is eating fruit on a wire grate.	A yellow bird eating fruit on a bird feeder.
64	3.7977858	You should do it.	You can do it, too.
65	4.81585	Two dogs and one cat sitting on couch.	Two dogs and a cat resting on a couch.
66	2.4660614	A man sitting in a back yard playing the guitar.	A man riding on the back of an orange SUV.
67	3.8858473	A wet child enjoys the summer.	A woman is enjoying the summer weather.
68	3.9502003	Blond boy jumping onto deck.	A boy jumping down a wet inflatable slide.
69	4.609541	A girl in a riding hat on a horse.	A girl riding a brown horse.
70	3.793706	You shouldn't feel any obligation at all.	You don't need sauce at all.
71	4.0022683	Sure, I've  done this very trip.	I've done this many dozens of times.
72	3.7643898	You can use it, too.	You can still use it for practice.
73	3.4621692	For the full 12-month period, high-speed cable modem connections increased by 49 percent.	For the full year period ending June 30, 2003, high-speed lines increased by 45 percent.
74	2.9296227	It is impossible to answer this question without a form check.	This is a part answer to your question
75	4.400615	Singapore reported no suspected SARS cases Wednesday, but officials quarantined 70 people who had contact with the Taiwanese patient.	Still, Singapore quarantined 70 people who had been in close contact with the scientist.
76	2.1084175	A man is playing a cello.	A man is rapidly lifting small weights.
77	4.262231	Both of these kids are in wonderful physical condition right now, he said during a press briefing at the hospital.	Both of these kids are in wonderful physical condition right now, said Goodrich, also director of pediatric neurosurgery at the Children's Hospital at Montefiore.
78	4.090644	In the United States, 20.7 percent of all women smoke.	Nevada is where the most women smoke, 28 percent.
79	2.6574855	A man and a woman watch two dogs.	A man in a maroon bathing suit swings on a rope on a lake.
80	3.8738632	The man is throwing knives at a tree.	A man is throwing blades into a close target outside.
81	4.605303	Crowd of people walking past a giant mushroom.	A group of four people walking past a giant mushroom.
82	2.8052177	Vietnamese citizens need a visa to visit the USA.	Nepalese citizens require a visa to visit the UK.
83	3.3783536	Two women in a clothing store.	Two women in a sailboat.
84	3.745289	Brendsel and chief financial officer Vaughn Clarke resigned June 9.	The company's chief executive retired and chief financial officer resigned.
85	4.621604	I have few suggestions for you:	I have two suggestions for you:
86	4.438499	Taylor's aides warn an abrupt departure could trigger more chaos, a view shared by many in Liberia and, in private, even by mediators.	His aides warn an abrupt departure could trigger more bloodshed, a view shared by many in Liberia.
87	4.643071	A black dog stands next to materials at a construction site.	A black dog stands in the middle of a construction site.
88	4.61656	Joe Kernan, who had been lieutenant governor for the past seven years, was sworn in as governor after O'Bannon died Saturday.	Kernan, who was O'Bannon's lieutenant governor, friend and political partner, was sworn in six hours after O'Bannon died Saturday.
89	1.9049606	A woman is exercising.	A man is dancing.
90	4.985561	A man in a top hat rides a white horse.	A man with a top hat riding a white horse.
91	2.8545191	Adding aspirin to the water could kill the plant.	Men are trying to remove oil from a body of water.
92	4.2104774	A few more point to think about:	A few things to think about:
93	3.5611236	In the first case, I think you don't need it.	So I don't think you need to put it on the cover.
94	4.4867873	An oriental lady is cutting a carrot into thin pieces.	A woman is slicing a carrot.
95	3.944683	The support will come as a free software upgrade called WebVPN for current customers that have support contracts.	The upgrade will be available as a free download for current customers with SmarNet support in January 2004.
96	3.489614	You don't need to know everything.	They just don't want you to know it.
97	4.535322	The dog plays in the park.	The dog leaps over the fence in the park.
98	3.4872618	Someone is slicing a onion.	Someone is carrying a fish.
99	4.2762094	A flock of birds hovered over the sandy beach.	Birds are flying at a beach.
100	4.845441	The device plays Internet radio streams and comes with a 30-day trial of RealNetworks' Rhapsody music service.	The product also streams Internet radio and comes with a 30-day free trial for RealNetworks' Rhapsody digital music subscription service.
101	4.6815944	This is not a good idea.	Not a good idea.
102	4.4891195	Reuters witnesses said many houses had been flattened and the city squares were packed with crying children and the homeless, huddled in blankets to protect them from the cold.	Reuters witnesses said public squares were packed with crying children and people left homeless, huddled in blankets to protect them from the cold.
103	2.6762838	The woman is kneeling next to a cat.	A girl is standing next to a man.
104	4.4096355	Beer bottles (-LRB- Harp Lager )-RRB- lined up on the floor.	A row of beer bottles on the floor.
105	4.670792	A boy is playing a key-board.	A little boy is playing a keyboard.
106	3.797538	"My answer to your question is ""Probably Not""."	I think that the short  answer to your question is: No.
107	3.5223162	Two little girls talk on the telephone.	Two couple are talking with each other.
108	4.903083	A black dog running into the water.	A black dog running through water.
109	3.1049256	A woman is slicing an onion.	A woman is slicing lemons.
110	4.041705	A young man wearing a striped shirt is holding two bicycles.	Young redheaded man holding two bicycles near beach.
111	4.768398	A young woman is putting stickers all over her face.	A woman is applying stickers to her face.
112	4.5486817	a small bird sitting on a branch in winter.	A small bird perched on an icy branch.
113	3.1480489	You need to read a lot to know what you like and what you don't.	You have to decide how much you want to demand, and what unmet demands you can live with.
114	3.6632156	A dog is standing in the sand.	A tan dog is standing in front of some plants.
115	4.743666	Does this page answer your question?	Does this answer your questions?
116	4.4265723	A man is standing in front of the window and looking outside.	A man is staring out the window.
117	4.4941783	Only Intel Corp.'s 0.3 percent yield was lower.	Only Intel Corp. has a lower dividend yield.
118	4.268258	A soldier walks a dog.	A man walks a dog.
119	4.521953	Brown and black dogs on snow, showing teeth and barking at each other.	A black dog fighting with a brown dog in the snow.
120	3.1480315	A person is riding a motorcyle.	A person is chopping an onion.
121	3.6910443	This is a very unusual request.	This sounds a bit unusual.
122	4.819289	There is a cook preparing food.	A cook is making food.
123	4.473899	Bremer, 61, is a onetime assistant to former Secretaries of State William P. Rogers and Henry Kissinger and was ambassador-at-large for counterterrorism from 1986 to 1989.	Bremer, 61, is a former assistant to former Secretaries of State William P. Rogers and Henry Kissinger.
124	4.579189	I had the same problem as you.	I have exactly the same problem.
125	4.4633965	The respected medical journal Lancet has called for a complete ban on tobacco in the United Kingdom.	A leading U.K. medical journal called Friday for a complete ban on tobacco, prompting outrage from smokers' groups.
126	4.968913	A man plays a trumpet.	A man is playing the trumpet.
127	4.623299	It depends entirely on your company and your contract.	I guess it depends on the nature of your contract.
128	4.7913427	a close up head of an ostrich.	A close up of an ostrich face.
129	4.221984	A panda bear is chewing on a stick.	A baby panda plays with a stick.
130	3.0246713	A woman is peeling shrimp.	A man is squeezing water.
131	4.7493505	Chaudhry was released 56 days later and the Fiji military installed an all-indigenous government led by Qarase, who won democratic elections in September 2001.	The Fijian military installed an all-indigenous government led by Mr Qarase, who won democratic elections in September 2001.
132	2.750897	A child wearing blue and white shorts is jumping in the surf.	A girl wearing green twists something in her hands.
133	3.8443322	Hope this is what you are looking for.	If what you are looking for is much higher, they get the picture.
134	4.2544465	The new companies will begin trading on Nasdaq today under the ticker symbols PLMO and PSRC.	Also as part of the deal, PalmSource stock will begin trading on the NASDAQ stock market Wednesday under the ticker symbol: PSRC.
135	2.6387393	A man is preparing a snake for cooking.	The man is dropping sliced cucumbers into water.
136	3.670782	You need to read a lot to know what you like and what you don't.	You have to know what you want to do.
137	4.9541836	a dog jumps into the water.	A dog is jumping into the water.
138	3.6310327	A woman is sitting in the water.	The woman is skating in the park.
139	2.0852334	Two men standing in grass staring at a car.	A woman in a pink top posing with beer.
140	4.2478557	A machine is sharpening a pencil.	The machine shaved the end of the pencil.
141	4.521522	A cheetah is running behind its prey.	A cheetah chases prey on across a field.
142	4.9481077	The man is kissing and hugging the woman.	A man is hugging and kissing a woman.
143	4.889009	The Bush administration blames Hussein loyalists and foreign Muslim militants who have entered Iraq to fight U.S. troops for the wave of bombings and guerrilla attacks.	The Bush administration blames the wave of bombings and guerrilla attacks on Saddam loyalists and foreign Muslim militants who have entered Iraq to fight U.S. troops.
144	4.6205325	Yucaipa owned Dominick's before selling the chain to Safeway in 1998 for $2.5 billion.	Yucaipa bought Dominick's in 1995 for $693 million and sold it to Safeway for $1.8 billion in 1998.
145	4.836828	Group of people posing with two men dressed as Elvis.	A group of people standing with two other people dressed as Elvis.
146	3.5280526	You may have to experiment and find what you like.	You have to find out what works for you.
147	4.2745166	A man is breaking wooden boards with his hand.	A man is breaking tiles with his hands.
148	3.4321675	Ten people riding ATVs.	4 people are riding bikes
149	3.4408257	A man is opening a box and taking out paper.	A woman is peeling a potato.
150	3.663507	If you haven't, you should.	You should, but you don't have to.
151	4.954312	A woman and man are dancing in the rain.	A man and woman are dancing in rain.
152	4.7082987	A man steers a blue boat past brightly colored houses.	a man driving a blue boat passes by some colorful houses.
153	4.0109196	I would look at this: U.S.	I would look at this way: 
154	4.031771	Three boys in karate costumes are fighting.	Three men are practicing karate moves in a field.
155	2.7734663	A man is cutting paper with a sword.	A woman is cutting a tomato.
156	3.0557206	It's all in her head.	It's all about adhesion.
157	4.8195333	There are a total of 659 women enrolled at the academy, the report said.	There were 659 women enrolled at the academy at the time of the survey.
158	4.328344	Parrot pushing a small shopping cart.	A white bird is steering a shopping cart.
159	2.6500878	"We put a lot of effort and energy into improving our patching process, probably later than we should have and now we're just gaining incredible speed.	We've put a lot of effort and energy into improving our patching progress, probably later than we should have."	
160	2.4092088	A woman is pouring egg into a frying pan.	A man is petting two dogs.
161	2.6629844	The man is mixing whipping cream.	The man is holding a skunk.
162	2.3158305	A man in a wet suit is throwing a baby wearing a wet suit up into the air.	A man in a white print shirt and a woman in a black dress dancing.
163	4.1068754	A black and white dog runs through the water.	Black and brown dog runs through field.
164	4.3640404	A man tries to feed a mouse to a snake.	A man is teasing a snake with a mouse.
165	2.3983276	An okapi is eating from a tree.	A moose drinks from a sprinkler.
166	4.197387	Box cutters were used as a weapon by the Sept. 11, 2001, hijackers and have since been banned as carry-on items.	Box cutters were the weapons used by the 19 hijackers in the Sept. 11, 2001, attacks.
167	3.9892392	A man is playing a guitar.	A man is singing while playing the guitar.
168	3.0531878	Large group of people standing outside of a building.	A group of people are ice skating in a big city.
169	4.0894995	Two black dogs are jumping and playing with a yellow tennis ball in the snow.	A brown dog and a black dog playing with a yellow soccer ball.
170	4.187429	A monkey is playing drums.	Someone in a gorilla costume is playing a set of drums.
171	4.5401545	This is not a good idea.	But it is not a good idea.
172	3.7461927	A man eats popcorn while watching cartoons late one night.	A man and a girl are watching cartoons at home
173	4.3282156	There are a few things I think you should do.	There are quite a few things you would need to do;
174	4.401204	A man is cutting pieces of butter into a mixing bowl.	Pieces of butter is added in the stand mixer.
175	3.9475894	A green and white cargo plane taking of from an airport.	White and green commercial airliner taking off of runway.
176	4.35211	A bicycle is parked by a shop.	A bicycle is parked outside a bookstore.
177	4.3604207	I'd say it primarily depends on two things:	I'd say it depends on the ultimate outcome you want?
178	4.5304384	The boy also sprayed the room full of retardant from fire extinguishers, which made it hard to see, the chief said.	The boy fired once into a wall and sprayed the room with fire extinguishers, making it hard to see, the chief said.
179	4.274333	We need to change old habits and seriously rethink business-as-usual.	"He urged employees to ""avoid complacency"" and to ""change old habits and seriously rethink business-as-usual."""
180	3.2607448	A woman riding a brown horse.	A woman taking her own photo from above.
181	4.6644254	A baby panda goes down a slide.	A panda slides down a slide.
182	3.050555	I'm going to be very direct here.	I'm going to be blunt, here: You don't.
183	2.9546678	Small child playing with letter P	2 young girls are sitting in front of a bookcase and 1 is reading a book.
184	3.278051	You are not disclosing key info.	No you are not.
185	2.6348927	A woman is cutting an onion.	A horse is standing.
186	4.8477454	The BlueCore3-Multimedia includes a 16-bit stereo audio CODEC with dual ADC and DAC for stereo audio.	BlueCore3-Multimedia contains an open platform DSP co-processor and also includes a 16-bit stereo audio codec with dual ADC and DAC for stereo audio.
187	3.6078434	I think you've pretty much done your review.	You've pretty much answered your own question.
188	4.8818088	A young person  deep in thought.	A young man deep in thought.
189	4.415197	Through Thursday, Oracle said 34.75 million PeopleSoft shares had been tendered.	Some 34.7 million shares have been tendered, Oracle said in a statement.
190	2.8695827	A steam engine and train moving toward the camera.	A white sheep on a hillside looking at the camera.
191	4.9128327	It's not a good idea.	It is not a good idea.
192	4.765723	Young couple sitting on a black couch.	Young couple sitting on couch.
193	4.0265436	I would personally beware of the Motley Fool.	I would recommend looking at The Motley Fool.
194	3.1703951	There are two possible causes for this:	There are two options for you - 
195	3.357569	Sometime if you really want it you might need to pay an agency to get the place for you.	You could probably get a tour agency to do it for you but it would cost you.
196	4.0874953	A turtle is swimming in water.	A turtle is walking underwater.
197	4.5054584	Bremer said one initiative is to launch a US$70 million nationwide program in the next two weeks to clean up neighborhoods and build community projects.	Bremer said he would launch a $70-million program in the next two weeks to clean up neighborhoods across Iraq and build community projects, but gave no details.
198	4.409624	Bashir felt he was being tried by opinion not on the facts, Mahendradatta told Reuters.	Bashir also felt he was being tried by opinion rather than facts of law, he added.
199	2.7704139	A man dressed in a pale scarf with a stick.	A runner is resting in the shade with a bottle of soda.
200	4.7594857	The rule - When in doubt throw it out!	"I always go by the rule ""When in doubt, throw it out!"
201	3.4078217	Rocky and Apollo Creed are running down the beach.	The men are jogging on the beach.
202	4.1943007	Black and white cow standing near pile of snow.	a black and white cow standing in the field.
203	3.9573336	Navistar shares were down 44 cents, or 1.1 percent, at $41.19 on the New York Stock Exchange after falling as low as $39.93.	Navistar shares rose a penny to $41.64 at late afternoon on the New York Stock Exchange after earlier falling as low as $39.93.
204	3.532577	It depends on what you want to have in your tank.	It depends on what you want to achieve.
205	4.517931	Three goats are being rounded up by a dog.	Three goats are chased by a dog.
206	4.4763846	"Nonetheless, the open-source guru insisted, ""This attack was wrong, and it was dangerous to our goals."""	This attack was wrong, and it was dangerous to our goals, Raymond said.
207	4.727385	It will take time to oust die-hard remnants of Saddam Hussein's deposed regime in Iraq, Defense Secretary Donald H. Rumsfeld said Tuesday.	Defense Secretary Donald H. Rumsfeld said Tuesday it will take time to locate die-hard remnants of Saddam Hussein's deposed regime in Iraq.
208	4.6456676	There's not a lot you can do about that.	I really do not think there is much you can do about that.
209	2.8279548	A man is playing a piano.	A guy is peeling a potato.
