id	score	sentence1	sentence2
210	4.6020417	A man and woman sit at a table in a restaurant.	Four women and two men sit at a long table in a restaurant.
211	4.3247433	A boy is playing the violin onstage.	A boy is playing an instrument.
212	4.8106356	A sheep beside a road and a lake.	A sheep is on the edge of a road with a lake and a mountain in the background.
213	2.6426342	A man is reading an email.	A person opening a banana.
214	3.4074914	"Jeremy's a good guy, Barber said, adding: ""Jeremy is living the dream life of the New York athlete."	"He also said Shockey is ""living the dream life of a New York athlete."
215	4.361675	I have the same thing.	I have had the same problem.
216	4.6760254	A man and a dog on rocks on a beach.	A man and dog on a rocky seashore.
217	2.703123	Dog is jumping down a ramp.	A girls is jumping in the sand.
218	4.3946447	A orange and white cat laying on a blanket in a black leather chair.	A ginger and white cat curled up and asleep on a leather chair.
219	4.5532365	There are three options:	There are only three options:
220	3.8431044	Two dogs play in the grass.	Two tan dogs play in the snow.
221	3.140384	You just have to base your answer on what you do know, which is what you want.	So if that's what you need, you really do have to be explicit about it.
222	4.535138	An empty office cubicle.	An empty office chair in a cubicle.
223	4.5122204	A girl is styling her hair.	A girl is brushing her hair.
224	4.694647	Blue and red plane in mid-air flight.	a blue and red airplane while in flight.
225	4.2954497	You guys are making this all WAAAAAY too complicated.	You are making this too complicated.
226	2.282913	The technology-laced Nasdaq Composite Index .IXIC shed 15 points, or 0.98 percent, to 1,492.	The broader Standard & Poor's 500 Index <.SPX> edged down 9 points, or 0.98 percent, to 921.
227	3.7129288	The meat, poultry, butter, cheese and nuts were impounded a year ago at a LaGrou Cold Storage warehouse in Chicago.	The meat, poultry, butter, cheese and nuts were being stored by more than 100 wholesalers in Chicago.
228	2.5415425	A baby elephant is eating a small tree.	A little girl peddling a scooter.
229	4.4343967	The man is sitting cross legged wearing a cloak and holding a stick.	Man sitting cross legged while wearing a brown cloth and holding a wooden stick.
230	4.5859423	One witness told Anatolian he saw the plane on fire while it was still in the air.	One witness told the Anatolian news agency he saw the plane on fire in mid-air.
231	4.496157	It depends on what they are.	It depends on how it's used.
232	4.137336	Two cats sitting on a couch looking out the window.	A cat looking out of a window.
233	4.095173	A black and white photo of a man driving a car and someone with a motorcycle.	A black and white photo of a man in a classic car and a man with a classic motorcycle.
234	4.5019126	Authorities appealed to the public Friday to come forward and provide what could be the key to solving the sniper-style shootings that have killed three people outside area convenience stores.	Authorities looked to the public yesterday for help in solving the deadly sniper-style shootings of three people outside Charleston-area convenience stores.
235	2.7092404	The kids are at the theater watching a movie.	it is picture day for the boys
236	3.4138772	A man is demonstrating how to work with clay while at least two people observe.	At least one of the three women is talking to the others.
237	3.2585714	I was in a similar situation.	Personally when I was in a similar situation I sent the couple a card and a gift.
238	2.0169034	The girl is carrying a baby.	A man is eating a food.
239	3.5280209	The answer to both questions is: Yes.	If the answer to any of these questions is yes, a PhD may be worthwhile for you.
240	4.1380796	The people are lifting bags.	Several people are carrying large bags.
241	3.3218167	The dollar was at 117.85 yen against the Japanese currency, up 0.1 percent.	Against the Swiss franc the dollar was at 1.3289 francs, up 0.5 percent on the day.
242	3.567622	A man is performing labor.	A man is performing today.
243	4.885895	I've had this same problem.	I had this same problem.
244	4.79549	As well as the dolphin scheme, the chaos has allowed foreign companies to engage in damaging logging and fishing operations without proper monitoring or export controls.	Internal chaos has allowed foreign companies to set up damaging commercial logging and fishing operations without proper monitoring or export controls.
245	4.8238187	A person is slicing onions.	Someone is slicing an onion.
246	4.111057	The security official's backup couldn't fill in because he was on active military duty, Strutt said.	The security official's backup was on active duty, and the lottery association didn't have a replacement in New Jersey, Strutt said.
247	4.706605	A boy studies a calendar.	A boy is looking at a calendar.
248	3.3131955	There's not a lot you can do about that.	There's not that much that you can do with a sourdough starter.
249	3.8629227	A car is driven down the road.	A girl is walking down a road.
250	4.6503406	In so many different ways, the artistry of black musicians has conveyed the experience of black Americans throughout our history, Bush said.	Surrounded by singers from Harlem, Bush said: ''The artistry of black musicians has conveyed the experience of black Americans throughout our history.
251	3.5556817	Vivendi shares closed 1.9 percent at 15.80 euros in Paris after falling 3.6 percent on Monday.	In New York, Vivendi shares were 1.4 percent down at $18.29.
252	4.4146194	Shares of McDonald's Corp. and Wendy's International Inc. continued a modest run-up on the New York Stock Exchange Monday.	Shares of McDonald's and Wendy's continued their recent recovery Monday, rising more than 1 percent on the New York Stock Exchange in afternoon trade.
253	4.071392	You have to decide what you want to get out of this.	You have to know what you want to do.
254	4.2835913	Dennehy, who transferred to Baylor last year after getting kicked off the University of New Mexico Lobos for temper tantrums, had begun to read the Bible daily.	Dennehy, who transferred to Baylor last year after getting kicked off the University of New Mexico Lobos for temper tantrums, became a born-again Christian in June 2002.
255	2.5995066	A little boy and a little girl playing together outside.	A woman wearing a white shirt stands on the street.
256	4.4800673	A black dog is jumping out of water.	A black dog is shaking off water.
257	3.1508684	A person is watching people ski down the hill.	The woman is jumping a long distance while people watch.
258	4.4196663	It depends on what you want to do next, and where you want to do it.	I guess it depends on what you're going to do.
259	3.0905185	You can use it, too.	Yes, you can do it.
260	3.8849964	A man is playing the piano.	A man played the guitar.
261	4.327521	Older woman holding newborn baby.	a woman sitting on a sofa holding a baby.
262	3.1866293	A man is opening a door.	A man is cutting an onion.
263	4.280267	Two kids are swimming.	Six kids are going swimming.
264	3.625967	National Breast Cancer Centre chief executive Professor Christine Ewan said it was too early to quantify the risk to women.	National Breast Cancer Centre head Professor Christine Ewan said there was no need for panic.
265	4.679405	Frank Quattrone, the former Credit Suisse First Boston technology investment-banking guru, reportedly pleaded not guilty Tuesday to charges of obstruction of justice and witness tampering.	NEW YORK -(Dow Jones)- Former star investment banker Frank Quattrone pleaded not guilty Tuesday to criminal charges of obstruction of justice and witness tampering.
266	3.597546	Yes, it's probably a good idea to renew your passport.	It's a good idea.
267	4.2133775	"Schools Chancellor Joel Klein said the push for higher standards and accountability ""is showing results."""	Schools Chancellor Joel Klein said he was pleased by the results.
268	4.350398	State health officials said today a young northeast Kansas woman likely has the state's first case of monkeypox among humans or animals.	Health officials confirmed today that a northeast Kansas woman has the state's first case of monkeypox and the first case west of the Mississippi River.
269	3.8852584	The man is using a camera to hammer a nail.	Someone is banging a camera lense against a nail.
270	3.0604005	A young pitcher is throwing the baseball.	A brown dog is walking on the grass beside a fence.
271	4.855136	The man is eating.	A man is eating food.
272	3.3353887	Two children splashing in the water.	Two dolphins jumping into the water.
273	4.9417634	Two zebras play in an open field.	Two zebras are playing in a field.
274	4.966697	Train in a station.	a train in a station.
275	4.794233	A cat is eating some corn.	A cat is eating corn on the cob.
276	4.967762	A red and white bus drives down an England street.	A red and white England bus drives down the street.
277	4.149227	Blue couch and twin bed in a living room.	Blue couch in room with sun shining in.
278	4.193253	Several people on motorcycles in a market square.	People on motorbikes in a city street.
279	4.201908	Two women sitting in chairs in a shop.	Two women are sitting in a cafe.
280	4.363038	He proposed a system under which it would take fewer and fewer votes to overcome a filibuster.	Frist proposed a process in which it would take gradually fewer votes to overcome filibusters preventing final votes on judicial confirmations.
281	3.9688306	Five men jump into a swimming pool.	A group of swimmers fall into a pool.
282	4.100547	I would say you can do it, but it wouldn't be advised.	Personally, I would say not unless it suits you.
283	4.89797	Group of people sitting around a restaurant dining table.	A group of people sitting at a restaurant table.
284	3.806008	Yes, you should mention your experience.	Yes, you should make a résumé.
285	3.7377274	A passenger train waiting at the city train station.	A passenger train with a yellow engine.
286	4.50826	A girl in a riding hat on a horse.	A girl riding a tan horse.
287	3.6117435	Two girls are running.	Three boys are running.
288	3.3304095	A woman peels garlic with her hands.	The woman is slicing herbs.
289	4.711464	A man is playing a musical keyboard.	A man is playing a keyboard piano.
290	4.1527247	Three young women standing in a room together.	Three dark haired young women in white, red and black sweaters.
291	4.7414675	On the cell's surface, the foreign components are recognised by other cells that then realise it is infected and kill it.	The foreign bits are recognized by other cells that realize it is infected and kill it.
292	3.5947287	But HRT should not be used to prevent heart disease or any other chronic condition.	The clear message is it should not be used to prevent cardiovascular disease, Manson said.
293	2.4632924	The cat is sitting on a bag of cat food.	Two eagles sitting on a long branch.
294	4.605613	Some men are sawing.	Men are sawing logs.
295	4.8861	Three children playing on a floor with toys.	Three children sitting in floor playing with several toys.
296	4.905601	The discovery that the MAP bug is present in the vast majority of Crohn's sufferers means it is almost certainly causing the intestinal inflammation, it said in a statement.	The researchers say that the fact the MAP bug is present in the vast majority of Crohns sufferers means it is almost certainly causing the intestinal inflammation.
297	4.663309	The boy is raising his hand.	The man is raising his hand.
298	4.9303837	What are your goals?	What are you goals?
299	4.125599	He is about to run into the boat	The man is getting his boat clean to take it out on the water.
300	4.8324823	The dogs play in the snow on hind legs.	Two dogs play in the snow.
301	3.0884924	A red haired women in black is posing for a man while resting on a tree.	A man in a black shirt is holding a child wearing sunglasses.
302	1.9049606	A man is dancing.	A woman is exercising.
303	4.390447	The American Express Corp. has pledged at least $3 million of more than $5 million needed.	The city had requested federal funds, but withdrew that request when American Express pledged at least $3 million.
304	4.270466	On July 22, Moore announced he would appeal the case directly to the U.S. Supreme Court.	Moore of Alabama says he will appeal his case to the nation's highest court.
305	4.04189	Gillespie sent a letter to CBS President Leslie Moonves asking for a historical review or a disclaimer.	Republican National Committee Chairman Ed Gillespie issued a letter Friday to CBS Television President Leslie Moonves.
306	3.0027363	The man is talking.	A man is walking down stairs.
307	3.7969005	Home office space with bright green walls and artwork.	An office with multiple desks and green walls.
308	4.5807314	A black hooded man is using a large magnifying glass to look at a booklet.	A white hooded woman is using a magnifying glass to look at a booklet.
309	2.9677188	The men played follow the leader on the grass.	The rhino grazed on the grass.
310	3.447045	I don't think that there's any.	I don't think there are any benefits.
311	4.9231825	A brown dog runs towards the camera on a dirt trail with mountains in the background.	A brown dog runs toward the camera down a rocky trail through the brush with mountains in the background.
312	3.9312878	A black train moves down the tracks.	A long train is on train tracks.
313	4.410282	A young laughing girl and a boy are playing on a big drum.	A baby girl and little boy are standing next to a guitar and a drum.
314	3.032661	This is a problem that the professor has to deal with.	This is a big problem.
315	4.433525	Yes, you should mention your experience.	Yes, you should mention it.
316	4.354349	It depends on what you want to do next, and where you want to do it.	It depends on what and where you are going to do.
317	3.8778877	Canada is a small country, and it needs companies like this, deals like this.	"A passionate nationalist, Mr. D'Alessandro said: ""Canada is a small country, and we need more companies like this."""
318	3.861194	"A promotional poster, complete with countdown dial, reminds readers of the upcoming release of ""Harry Potter and the Order of the Phoenix."""	"The crates are full of hardback copies of ""Harry Potter and the Order of the Phoenix."""
319	4.868345	A yellow car speeds along a snowy field.	A yellow car drives quickly in the snow.
320	4.96052	The dog is running through a field.	A dog runs through a field.
321	4.7718544	Special police detained Khodorkovsky early on Saturday in the Siberian city of Novosibirsk, where his plane had made a refuelling stop.	Police detained Khodorkovsky early on Saturday when his jet made a refueling stop in the Siberian city of Novosibirsk.
322	2.9565299	A little girl in a white blouse and blue pants frolics on the grass.	A woman in a green shirt and white pants golfs on the green.
323	2.8579977	In morning trading, the Dow Jones industrial average was up 40.12, or 0.5 percent, at 8,571.69, having fallen 51 points Monday.	In New York, the Dow Jones industrial average a gauge of 30 blue chip stocks was up 3.29 points or 0.04 per cent to 8,585.97.
324	2.6484454	If you are not sure how to do it, don't do it at all.	You don't, it will not work.
325	3.4381995	It is more deciding what you should do and what you should get others to do.	Point is: know what you want and don't be afraid to ask for it.
326	4.97917	Two dogs are running in the field.	Two dogs running in a field.
327	3.0450284	A black and white cat and dog on a striped couch.	A black and white cat standing in front of a window.
328	2.5549457	A train is moving.	A man is doing yoga.
329	4.6138334	Now, with the agency's last three shuttles grounded in the wake of the Columbia disaster, that wait could be even longer.	With the remaining three shuttles grounded in the wake of the Columbia accident, the rookies will have to wait even longer.
330	2.330369	A person is boiling noodles.	A cat is licking a bottle.
331	4.029994	Two women sitting outside laughing.	Two women standing outside of a bus.
332	4.043456	You should do it.	You should never do it.
333	3.6668587	Some of what you can do:	Not much you can do besides:
334	4.5596046	The # 2 greyhound dog is running around a track.	a muzzled greyhound dog is running around a track
335	4.5100026	The new analysis found that 32 of the 16,608 participants developed ovarian cancer during about 5 years of follow-up.	The new analysis found that 32 of 16,608 participants developed ovarian cancer in about 5 1/2 years of follow-up, including 20 women taking hormones.
336	3.5826764	The benchmark 10-year Treasury note yield <US10YT=RR> dipped below 4.20 percent on Tuesday.	Prices for Treasury securities also rose, with the yield on the benchmark 10-year note falling to 4.19 percent.
337	4.781365	The two dogs are playing in the yard.	Two dogs are playing on the grass.
338	3.904569	The elderly and those with weakened immune systems are also urged to protect against mosquito bites.	But for the elderly and those with weakened immune systems, it can be fatal.
339	4.186815	Four people rowing down a river.	Four people row a canoe in water.
340	4.700576	If your long stay visa for Switzerland is valid, then you will not need a transit visa.	You do not need a transit visa, but to enter Zurich you will need a visa.
341	2.641448	The man is playing the guitar.	The man is peeling a potato.
342	4.409816	Democrats currently hold a 17-15 advantage in the state's congressional delegation.	The Texas congressional delegation now is 17-15 Democratic.
343	4.5731287	I remained under the banyan tree, exhausted by my daily ritual of dragooning the men every two hours. 	I remained under the banyan tree, exhausted by my daily ritual of herding the cats every two hours. 
344	3.986855	Miodrag Zivkovic, of the Liberal Alliance of Montenegro, won 31 percent of the vote while the independent Dragan Hajdukovic got four percent.	Miodrag Zivkovic, the leader of the pro-independence opposition Liberal Alliance, came in second with 31 percent of the vote.
345	4.2040296	The woman in overalls paints a picture for her wall.	A woman is painting her wall white.
346	4.5558887	The Swedish central bank was also meeting on Wednesday and widely expected to announce a cut on Thursday.	The Swedish central bank, also meeting on Wednesday, is widely expected to announce a cut on Thursday of as much as half a percentage point.
347	4.429735	A man and a woman walk with a white dog on a leash.	A man, woman and dog walk down a paved road.
348	2.892787	Yes, there is a reason to not do what you propose.	Valid reasons to feel the way you do, but not a reason to resign.
349	3.7411153	The man is playing the guitar.	The girl is playing the guitar.
350	3.3275673	You just have to base your answer on what you do know, which is what you want.	Th answer to you problem is that you dont actually know what you're getting in .
351	2.2662354	A woman is cracking eggs.	A man is talking to a woman.
352	3.8128738	I think you're looking for Mikey (1992).	I think you're looking for the movie
353	3.352705	The best thing you can do is to know your stuff.	The best thing to do is to overcome the fussiness.
354	4.533426	two cats, one brown and one white laying on a bed with a blue blanket.	Two cats, one ginger, the other white laying on a bed.
355	3.3411336	A woman in a plaid outfit is looking through a bag of produce.	This is the picture of a woman in a flowered dress, toting something in a bucket.
356	4.0923605	"The workers accuse General Dynamics of ""reverse age discrimination"" because of a change in retirement benefits in 1997."	General Dynamics was sued when it changed its retirement benefits in 1997.
357	4.582371	The curious boys look in the shed.	Two small boys in a woody area looking at a shed.
358	3.20219	Two ducks are standing by the water.	The birds are swimming in the water.
359	2.2976613	A woman is slicing ginger.	A person is holding two baby lorises.
360	3.4702106	A woman is wrapping tofu.	A woman is balling dough.
361	3.9727893	A person dices up an orange pepper.	The cook is slicing bell peppers.
362	4.43409	Another was in serious condition at Northwest Medical Center in Springdale.	At Northwest Medical Center of Washington County in Springdale, one child is in serious condition.
363	2.26544	Someone touched the kitten chewing on a string.	Someone is cutting paper.
364	2.8167806	Two men standing in grass staring at a car.	Two women sitting in chairs in a shop.
365	3.9339395	It depends on what you want to do next, and where you want to do it.	It's up to you what you want to do next.
366	4.873076	I don't think it makes any tremendous difference.	I don't think it makes much difference.
367	4.707678	The government did not identify the taikonauts — a term coined from ‘‘taikong,’’ the Chinese word for space — who would travel on the second mission.	The government did not identify the taikonauts -- a term coined from taikong, the Chinese word for space.
368	3.9842105	I did this one time as well.	I have this habit as well.
369	4.228404	a man wearing a gray hat fishing out of a fishing boat.	A man wearing a straw hat and fishing vest in a stream.
370	4.663721	"During the hearing, Morales expressed ""sincere regrets and remorse"" for his actions."	"Morales, who pleaded guilty in July, expressed ""sincere regret and remorse"" for his crimes."
371	3.3199325	A man is playing drums.	A man is playing his guitar.
372	2.8606482	A person is putting shredded cheese in a pot.	A hamster is eating some seeds.
373	3.7992234	The Space Infrared Telescope Facility's mission is to search for the beginnings of the universe.	NASA is scheduled to launch the Space Infrared Telescope Facility on Monday morning.
374	3.72589	It looks to me that this is set up for what you want:	It is up to you whether you want to do that.
375	4.12324	A tan and white dog retrieving a ball on a gravel path.	A large dog walks along a gravel path in the woods.
376	4.3411694	It depends on what you want to do next, and where you want to do it.	It depends on what you want to achieve.
377	2.8465872	A man is playing a guitar.	A man is eating pasta.
378	3.4850214	A person is slicing some onions.	A woman is chopping herbs.
379	3.1143074	A person is slicing an onion.	A person cuts ginger.
380	4.473756	A woman opens a window.	A woman is looking out a window.
381	2.2292242	Someone is folding a piece of paper.	A person is slicing a small pieces of ginger.
382	3.6027029	A dog running across the snow with a snowball in it's mouth.	A tan dog is running through the grass with a yellow toy in its mouth.
383	4.0287137	A car is pulling off the side of the road onto the street.	A silver car parked on the side of the road in front of the hills.
384	4.4387693	A man is picking up a tree.	A man is carrying a tree.
385	4.529273	A woman is dicing some peeled potatoes cut into thick strips.	A woman is chopping a peeled potato into slices.
386	2.8351994	A man is playing a harp.	A man is playing a keyboard.
387	3.8356204	You can do it, too.	Yes, you can do it.
388	4.311287	Two women walk down the sidewalk to the store.	Two women walk down the sidewalk in the afternoon.
389	3.964589	You don't have to worry.	You don't have to do anything to season it.
390	4.0989876	The child's bike got wet.	She is putting away the bike.
391	4.923218	Motorcycle parked next to a car outside.	A motorcycle parked next to a car.
392	2.848966	A man in a blue dress shirt.	A man in a white shirt and blue pants is talking with a woman in a pink shirt.
393	4.134067	We are expending all available resources toward the investigation, said Assistant U.S. Attorney Todd Greenberg, a counterterrorism prosecutor in Seattle.	We are aware of the situation, said Assistant US Attorney Todd Greenberg, a counter-terrorism prosecutor in Seattle.
394	3.9483738	A father napping in a chair with a baby on his lap.	Man with pink shirt sleeping on chair with infant.
395	4.533479	Take a look at these:	Take a look at this: 
396	4.7444324	"Ms Lafferty's lawyer, Thomas Ezzell, told a Kentucky newspaper: ""My understanding of this is that there is a lower percentage of successful impregnations with frozen."	My understanding of this is that there is a lower percentage of successful impregnations with frozen, Ezzell said.
397	4.803609	Two women give a demonstration at a Renaissance Fair.	Two people are doing a demonstration at a renaissance fair.
398	4.689287	Two skiing people are doing cross country skiing.	People skiing cross country.
399	4.7757416	Two people ride their bikes down a dirt road.	Two people riding their bikes on a hill.
400	4.8709717	A moped in front of steps of ruins.	A moped in front of ruins.
401	4.5681257	Rich media doubled its share, increasing from 3% in Q2 2002 to 6% in Q2 2003.	Rich Media interactive ad formats doubled their share from 3% in second quarter of 2002, to 6% in the second quarter of 2003.
402	3.510581	Three children playing in snow.	Three children playing in hay
403	2.9370413	A yellow vested person is doing road work.	A person is doing very well on their skateboard.
404	3.7544358	It depends on what you want to do next, and where you want to do it.	It depends on what you want to say/imply.
405	4.575638	Three men are doing same dance in the street.	Three shirtless men are dancing in the street.
406	3.5484939	From what I understand this is what you can do :	Can you do this?
407	4.7928467	A blue bird standing on a lawn.	Blue bird standing on green grass.
408	4.4993825	a black and white dog jumping in the air to catch a Frisbee	A black and white dog jumping in a yard.
409	4.363997	In the US, it will depend on the school.	This will depend on the university.
410	3.947841	"My answer to your question is ""Probably Not""."	The answer to your question is not really.
411	4.1485744	A girl is talking to her dad on a cellphone.	a girl is talking on her phone.
412	3.3493729	A man is playing piano.	A man is playing a violin.
